{
  "$schema": "https://json-schema.org/draft/2020-12/schema",
  "$id": "evidence.schema.json",
  "title": "Evidence",
  "description": "A source-backed claim. Evidence is what separates this product from a blog: every consequential fact points at a page, a date and a verification state. 'Not recorded' is never the same as 'not required'.",
  "type": "object",
  "required": ["id", "sourceUrl", "publisher", "retrievedAt", "verificationState", "supports"],
  "properties": {
    "id": { "type": "string", "pattern": "^ev-[a-z0-9]+(-[a-z0-9]+)*$" },
    "sourceUrl": { "$ref": "common.schema.json#/$defs/url" },
    "sourcePage": {
      "$ref": "common.schema.json#/$defs/url",
      "description": "The human-readable page, when sourceUrl is a PDF or API response."
    },
    "publisher": {
      "type": "string",
      "minLength": 2,
      "description": "Who is responsible for the rule — the institution, ministry, agency or portal. Not the aggregator that repeated it."
    },
    "publisherType": {
      "enum": ["institution", "national-agency", "ministry", "application-portal", "qualification-body", "aggregator", "other"],
      "description": "Who published it. Describes the organisation; says nothing about what it may be trusted to establish — that is sourceClass."
    },
    "sourceClass": {
      "enum": [
        "official-rule-owner",
        "admissions-authority",
        "recognition-body",
        "institutional-guidance",
        "promotion-agency",
        "school-guidance",
        "counselling-body",
        "encyclopaedic",
        "aggregator"
      ],
      "description": "What this source is allowed to establish. The first four are authoritative and may alone support a consequential claim; the rest may establish context and point at the official page, and can never on their own make an entry requirement, deadline or fee verified. src/lib/source-classes.mjs holds the matrix and scripts/validate.mjs enforces it, so this is a mechanical rule rather than an editorial intention."
    },
    "retrievedAt": { "$ref": "common.schema.json#/$defs/isoDate" },
    "effectiveFrom": { "$ref": "common.schema.json#/$defs/isoDate" },
    "effectiveTo": { "$ref": "common.schema.json#/$defs/isoDate" },
    "appliesToIntake": { "$ref": "common.schema.json#/$defs/intake" },
    "appliesToApplicantGroup": { "$ref": "common.schema.json#/$defs/applicantGroup" },
    "excerpt": {
      "type": "string",
      "maxLength": 1200,
      "description": "A short faithful quotation, or a structured restatement. Keeping the official wording lets a counsellor audit our interpretation."
    },
    "claim": {
      "type": "string",
      "description": "What we take the source to establish, in one plain sentence."
    },
    "supports": {
      "type": "array",
      "minItems": 1,
      "description": "Which record and field this evidence backs. Lets the freshness report find every claim that depends on a changed page.",
      "items": {
        "type": "object",
        "required": ["entity", "field"],
        "properties": {
          "entity": { "type": "string", "description": "Record id, e.g. opp-dk-dtu-general-engineering-2027." },
          "field": { "type": "string", "description": "Dotted path within that record, e.g. requirements[2].threshold." }
        },
        "additionalProperties": false
      }
    },
    "verificationState": { "$ref": "common.schema.json#/$defs/verificationState" },
    "verifiedBy": { "type": "string", "description": "DEPRECATED. Replaced by attestation and review, because one free-text field could not tell 'I read the page' apart from 'someone else checked me', and in practice recorded the first while implying the second. Kept so older records still validate." },
    "attestation": {
      "type": "object",
      "description": "Whoever wrote this record opened the source and read it. First-hand, single-pass and self-reported — worth a great deal, and not the same as having been checked. A record may carry an attestation and still sit at needs-review; that is the normal state of freshly researched work and it is honest. See src/lib/attestation.mjs.",
      "required": ["by", "at", "method"],
      "properties": {
        "by": { "type": "string", "minLength": 2, "description": "WHO read it, named so a later reviewer can be checked against it — 'the Ireland research pass', 'M. Pilley'. Not 'Read': that describes the act, not the party, and 108 records described the act." },
        "at": { "$ref": "common.schema.json#/$defs/isoDate" },
        "method": {
          "enum": ["read-source", "read-browser", "read-pdf", "read-secondary", "derived"],
          "description": "How it was read. 'read-browser' records that the page does not serve its content to a plain fetch, which is a finding in itself and explains why the automated checker cannot confirm it."
        },
        "note": { "type": "string", "maxLength": 800, "description": "What the reading turned up that the excerpt does not carry: two tables that disagree, a page stamped with its own update date, a figure that had to be summed." }
      },
      "additionalProperties": false
    },
    "review": {
      "type": "object",
      "description": "A SECOND party read the record back against its source and agreed. This is the only thing that earns verificationState 'verified'; scripts/test-sourcing.mjs fails a record that claims it without one, or that names the same party that attested it.",
      "required": ["by", "at"],
      "properties": {
        "by": { "type": "string", "minLength": 2, "description": "Who checked it. Must not be the party named in attestation.by." },
        "at": { "$ref": "common.schema.json#/$defs/isoDate" },
        "agreed": { "type": "boolean", "description": "False is a legitimate outcome and should be recorded rather than quietly corrected: it says the record was checked and found wrong, which is exactly what a reader needs to know happened." },
        "note": { "type": "string", "maxLength": 800 }
      },
      "additionalProperties": false
    },
    "role": {
      "enum": ["claim", "reference"],
      "description": "'claim' (the default) backs a specific published statement. 'reference' is a page consulted while building a record — an admissions hub, a key-figures report — which has no single sentence to match. A reference is still checked: it must stay live and stay about the same institution. The distinction exists so that citing background reading does not require inventing a claim to justify it."
    },
    "sourceCheck": {
      "type": "object",
      "description": "The result of re-opening the source and looking for the claim. NOT sign-off: this is produced by scripts/verify-evidence.mjs, and verificationState only becomes 'verified' when a person reads the excerpt and agrees. Its value is that it puts the supporting wording next to the claim, which turns review from a research task into a reading task.",
      "required": ["checkedAt", "outcome"],
      "properties": {
        "checkedAt": { "$ref": "common.schema.json#/$defs/isoDate" },
        "outcome": {
          "enum": ["supported", "partial", "unsupported"],
          "description": "supported: every consequential part was found. partial: some was, or the source cannot be read automatically. unsupported: nothing was found, or the page is gone."
        },
        "reason": { "type": "string" },
        "method": { "type": "string" },
        "excerpt": { "type": "string", "maxLength": 1200 },
        "claims": {
          "type": "array",
          "description": "One entry per claim this record backs, since a single page often supports several.",
          "items": {
            "type": "object",
            "properties": {
              "field": { "type": "string" },
              "entity": { "type": "string" },
              "decisive": { "type": "boolean", "description": "Whether this claim sets the record's outcome. Entry requirements do; a paraphrased description does not." },
              "outcome": { "enum": ["supported", "partial", "unsupported"] },
              "reason": { "type": "string" },
              "excerpt": { "type": ["string", "null"], "maxLength": 1200 },
              "details": {
                "type": "array",
                "items": {
                  "type": "object",
                  "properties": {
                    "requirement": { "type": "string" },
                    "role": { "enum": ["required", "one-of", "informational"] },
                    "found": { "type": "boolean" },
                    "matched": { "type": ["string", "null"] },
                    "weak": { "type": "boolean", "description": "Matched across a table layout rather than in a single phrase, so the excerpt is worth a closer read." }
                  },
                  "additionalProperties": false
                }
              }
            },
            "additionalProperties": false
          }
        }
      },
      "additionalProperties": false
    },
    "conflictsWith": {
      "type": "array",
      "items": { "$ref": "common.schema.json#/$defs/evidenceRef" },
      "description": "Other Evidence making an incompatible claim. A conflict downgrades the public result to Needs review; it must never silently resolve to the more permissive reading."
    },
    "interpretation": {
      "type": "string",
      "description": "Why we read the source this way, especially where it is ambiguous or contradicts another official page."
    },
    "meta": { "$ref": "common.schema.json#/$defs/recordMeta" }
  },
  "additionalProperties": false
}
