[
  {
    "id": "ev-ua-se-autumn-dates",
    "sourceUrl": "https://www.universityadmissions.se/en/key-dates-and-deadlines/autumn-semester-dates/",
    "publisher": "University Admissions (Universitets- och högskolerådet)",
    "publisherType": "application-portal",
    "sourceClass": "admissions-authority",
    "retrievedAt": "2026-09-22",
    "appliesToIntake": "2027-autumn",
    "verificationState": "needs-review",
    "claim": "For autumn 2027 the first admissions round opens 16 October 2026 and closes 15 January 2027, with supporting documentation due 1 February and bachelor results published 8 April. The second round runs 15 March to 15 April 2027, with results on 9 July.",
    "excerpt": "First admissions round … 16 October 2026 Application round opens. 15 January 2027 Application deadline + last day to rank your courses. 1 February Supporting documentation deadline. 8 April Admissions results published for Bachelor's. […] Second admissions round … 15 March 2027 Application round opens. 15 April Application deadline. 21 June Supporting documentation deadline. 9 July Admissions results published. 16 July Last day to reply to your offer.",
    "interpretation": "The two rounds are not equivalent and the difference decides the year for an IB applicant. The first round is the one carrying the English-taught programmes; the authority says of the second that \"many courses and programmes taught in English are no longer available for application\". So the real deadline for an international applicant is 15 January, with documents by 1 February — five months before IB results are published on 6 July.",
    "supports": [
      {
        "entity": "se-uhr-2027",
        "field": "milestones"
      }
    ],
    "meta": {
      "schemaVersion": "1.0",
      "dataAsOf": "2026-09-22"
    },
    "attestation": {
      "by": "the research pass that wrote this record",
      "at": "2026-09-22",
      "method": "read-source"
    },
    "sourceCheck": {
      "checkedAt": "2026-09-23",
      "outcome": "supported",
      "reason": "5 of 6 recorded requirement(s) found on the page",
      "method": "automated re-fetch and wording match (scripts/verify-evidence.mjs)",
      "excerpt": "…housing and plan for their move to Sweden Key dates Events 16 October 2026 Application round opens 15 January 2027 Application deadline + last day to rank your courses* 1 February Application fee deadline 1…",
      "claims": [
        {
          "field": "milestones",
          "entity": "se-uhr-2027",
          "decisive": true,
          "outcome": "supported",
          "reason": "5 of 6 recorded requirement(s) found on the page",
          "excerpt": "…housing and plan for their move to Sweden Key dates Events 16 October 2026 Application round opens 15 January 2027 Application deadline + last day to rank your courses* 1 February Application fee deadline 1…",
          "details": [
            {
              "requirement": "First round closes, and rankings lock — 2027-01-15",
              "role": "required",
              "found": true,
              "matched": "15 January",
              "weak": false
            },
            {
              "requirement": "Supporting documentation deadline — 2027-02-01",
              "role": "required",
              "found": true,
              "matched": "1 February",
              "weak": false
            },
            {
              "requirement": "Second round closes — 2027-04-15",
              "role": "required",
              "found": true,
              "matched": "15 April",
              "weak": false
            },
            {
              "requirement": "First admissions round opens — 2026-10-16",
              "role": "informational",
              "found": true,
              "matched": "16 October",
              "weak": false
            },
            {
              "requirement": "First round bachelor results published — 2027-04-08",
              "role": "informational",
              "found": true,
              "matched": "8 April",
              "weak": false
            },
            {
              "requirement": "IB results released — 2027-07-06",
              "role": "informational",
              "found": false,
              "matched": null,
              "weak": false
            }
          ]
        }
      ]
    }
  },
  {
    "id": "ev-ua-se-bachelor-requirements",
    "sourceUrl": "https://www.universityadmissions.se/en/entry-requirements/bachelors-requirements/",
    "publisher": "University Admissions (Universitets- och högskolerådet)",
    "publisherType": "application-portal",
    "sourceClass": "admissions-authority",
    "retrievedAt": "2026-09-22",
    "appliesToIntake": "2027-autumn",
    "verificationState": "needs-review",
    "claim": "General entry to a Swedish bachelor requires completed upper secondary education, English to the level of Swedish English 6, and mathematics to the level of Swedish Mathematics 1a/1b/1c. Specific requirements are set per programme.",
    "excerpt": "To meet the general entry requirements for bachelor's studies, you must: have successfully completed your upper secondary (high school) education (post-16), and be able to demonstrate proficiency in English. The entry requirement for bachelor's studies in Sweden is to have studied the equivalent of the Swedish upper secondary course English 6/English Level 2. For applicants who received their final school grades after 31 December 2009, there is an additional mathematics requirement. […] The equivalents listed are estimates.",
    "interpretation": "The authority labels its own subject equivalences as estimates, which is unusual and worth repeating rather than smoothing over. An IB student should treat a published IB-to-Swedish subject mapping as a guide and confirm against the programme.",
    "supports": [
      {
        "entity": "se",
        "field": "ibRecognition"
      }
    ],
    "meta": {
      "schemaVersion": "1.0",
      "dataAsOf": "2026-09-22"
    },
    "attestation": {
      "by": "the research pass that wrote this record",
      "at": "2026-09-22",
      "method": "read-source"
    },
    "sourceCheck": {
      "checkedAt": "2026-09-23",
      "outcome": "supported",
      "reason": "page is on-topic for this claim (4/12 content words present)",
      "method": "automated re-fetch and wording match (scripts/verify-evidence.mjs)",
      "excerpt": "…requirements To be eligible for bachelor's courses and programmes taught in English, you must meet the general and specific entry requirements. If you meet these requirements, you'll then compete for a place…",
      "claims": [
        {
          "field": "ibRecognition",
          "entity": "se",
          "decisive": false,
          "outcome": "supported",
          "reason": "page is on-topic for this claim (4/12 content words present)",
          "excerpt": "…requirements To be eligible for bachelor's courses and programmes taught in English, you must meet the general and specific entry requirements. If you meet these requirements, you'll then compete for a place…",
          "details": []
        }
      ]
    }
  }
]
